[
  {
    "schemaVersion": 2,
    "id": "training.context.read",
    "version": "1.0.0",
    "kind": "tool",
    "title": "Read training context",
    "description": "Reads the minimum local training context for one request.",
    "intentExamples": ["Review my recent training"],
    "inputSchema": {"type": "object"},
    "outputSchema": {"type": "object"},
    "executionLocation": "device",
    "risk": "read_only",
    "requiredScopes": ["training.read"],
    "confirmation": "never",
    "idempotency": "none",
    "dependencies": [],
    "surface": null,
    "tags": ["training", "context"],
    "fallback": "text_summary",
    "offlineSafe": true
  },
  {
    "schemaVersion": 2,
    "id": "training.plan.draft",
    "version": "1.0.0",
    "kind": "workflow",
    "title": "Draft a training plan",
    "description": "Creates a reversible local training-plan draft.",
    "intentExamples": ["Arrange shoulder training tomorrow"],
    "inputSchema": {"type": "object"},
    "outputSchema": {"type": "object"},
    "executionLocation": "device",
    "risk": "reversible_draft",
    "requiredScopes": ["training.read", "training.draft.write"],
    "confirmation": "before_commit",
    "idempotency": "required",
    "dependencies": ["training.context.read@^1"],
    "surface": "training.plan.draft@^1",
    "tags": ["training", "plan", "shoulder"],
    "fallback": "text_summary",
    "offlineSafe": false
  }
]
